BookName,Type,Date,Rate
"The Silent Wife: A gripping, emotional page-turner with a twist that will take your breath away  ",Paperback,2018,18014
Online Shopping Tracker: Keep Tracking Organizer Notebook for online purchases or shopping orders made through an online website (Vol : 2) (Order log)  ,Paperback,2019,11
Everything You Need to Know When I'm Gone - End of Life Planner for Affairs and Last Wishes: A Simple Guide for my Family to Make my Passing Easier  ,Paperback,2019,2034
"WTF Is My Password: password book, password log book and internet password organizer, alphabetical password book, Logbook To Protect Usernames and ... notebook, password book small 6” x 9”  ",Paperback,2019,2540
"End Of Online Shopping, The: The Future Of New Retail In An Always Connected World  ",Paperback,2018,7
"Peace of Mind Planner: Important Information about My Belongings, Business Affairs, and Wishes  ",Hardcover-spiral,2014,7109
What to Do When I am Dead: A Checklist for my Family - A Journal to help your Near & Dear ones navigate Life's Landscape once you are gone  ,Paperback,2019,136
It Ends with Us: A Novel (1)  ,Paperback,2016,167843
"Thrift Store Reselling Secrets You Wish You Knew: 50 Different Items You Can Buy At Thrift Stores And Sell On eBay And Amazon For Huge Profit ... Store Items, Selling Online, Thrifting)  ",Paperback,2018,337
Internet Password Book Organizer And Online Shopping Tracker: Two-In-One  ,Paperback,2018,28
"Shit I Can’t Remember: password book, password log book and internet password organizer, alphabetical password book, Logbook To Protect Usernames and ... notebook, password book small 6” x 9”  ",Paperback,2019,2926
"Online Shopping Tracker: Tracking Organizer Notebook For Online, Purchases,Order,Shopping Expense,Personal Log Book Fashion and Clothes Accessories Pattern  ",Paperback,2019,1
"Christmas Planner: The Ultimate Organizer - with Holiday Shopping List, Gift Planner, Online Order and Greeting Card Address Book Tracker  ",Paperback,2019,385
30 Days to Stop Being a Shopaholic: A Mindfulness Program with a Touch of Humor (30-Days-Now Mindfulness and Meditation Guide Books)  ,Paperback,2019,28
The Personal Internet Address & Password Logbook (removable cover band for security)  ,Hardcover-spiral,2010,22753
Beginner’s Korean with Online Audio (Hippocrene Beginner's)  ,Paperback,2019,7
"The Secrets to Selling on Amazon: How I Turned Nothing into Millions (Without Advertising, Dropshipping or Private Labeling)  ",Paperback,2019,110
Shit I Can't Remember Password Logbook: Alphabetical Password Log Book and Internet Password Organizer Keeper Journal Notebook  ,Paperback,2019,320
"Shopping Addiction: The Ultimate Guide for How to Overcome Compulsive Buying And Spending (Compulsive Spending, Compulsive Shopping, Retail Therapy, ... ... Compulsive Debtors, Debtors Anonymous)  ",Paperback,2014,192
Apple Picking Day! (Step into Reading)  ,Paperback,2016,1244
"Sound Innovations for String Orchestra, Bk 1: A Revolutionary Method for Beginning Musicians (Violin), Book & Online Media  ",Paperback,2010,1107
Sunday Shopping  ,Paperback,2019,16
"Password Log Book: Address Books For Passwords, Password Journal Alphabetical, Login Password Book, Password Organizer Book, Vintage/Aged Cover  ",Paperback,2018,488
"Smile, Sisters, and Guts: The Box Set  ",Paperback,2019,2426
The Art of Mixology: Classic Cocktails and Curious Concoctions  ,Hardcover,2018,7914
"Christmas Planner & Organiser: Festive Holiday Notebook Journal with List to Plan & Track Shopping, Christmas Cards, Present Buying, Meals & Online Orders  ",Paperback,2019,8
"Practicing Mindfulness: 75 Essential Meditations to Reduce Stress, Improve Mental Health, and Find Peace in the Everyday  ",Paperback,2018,6826
"Christmas Planner: Festive Organiser : Plan and Track Gifts, Cards, Meals, Online Shopping  ",Paperback,2019,1
The Complete Ketogenic Diet for Beginners: Your Essential Guide to Living the Keto Lifestyle  ,Paperback,2016,28699
Online Shopping Tracker: Keep Tracking Organizer Notebook for online purchases or shopping orders made through an online website (Vol : 9) (Order log)  ,Paperback,2019,1
The Whole30: The 30-Day Guide to Total Health and Food Freedom  ,Hardcover,2015,15527
"The Plant Paradox Quick and Easy: The 30-Day Plan to Lose Weight, Feel Great, and Live Lectin-Free (The Plant Paradox, 3)  ",Paperback,2019,9228
My Password Journal: The Gift Of Organization to Never Get locked out of your Online Accounts  ,Paperback,2018,126
Christmas Planner: Christmas Shopping & Online Orders Tracker Notebook with Wish List & Holiday Menu Planner  ,Paperback,2019,1
Acupressure - Point Functions  ,Paperback,2015,174
Shopping at the Used Man Store: and Other Writings  ,Kindle,2019,7
"The Complete Mediterranean Cookbook: 500 Vibrant, Kitchen-Tested Recipes for Living and Eating Well Every Day (The Complete ATK Cookbook Series)  ",Paperback,2016,16771
Retail’s Last Mile: Why Online Shopping Will Exceed Our Wildest Predictions  ,Kindle,2016,7
The House That Cleans Itself: 8 Steps to Keep Your Home Twice as Neat in Half the Time  ,Paperback,2013,381
"Shit I can't remember: Internet ID Password Keeper Address Logbook Passkey Record Journal Notebook Organizer Men, Women (Internet Password Login ID Logbook Journal Organizer Series)  ",Paperback,2018,278
Fundamentals of Nursing: Active Learning for Collaborative Practice  ,Paperback,2019,261
"Online consumer behavior: Theory and research in social media, advertising, and e-tail (Marketing and Consumer Psychology Series)  ",Hardcover,2012,5
The Brookside Story: Shops of Every Necessary Character (Brief History)  ,Kindle,2010,12
Marketing to Gen Z: The Rules for Reaching This Vast--and Very Different--Generation of Influencers  ,Hardcover,2018,77
ACEP First Aid Manual 5th Edition: The Step-by-Step Guide for Everyone  ,Paperback,2014,1402
The Absolute Guide to Online Shopping: PLUS 10 Tools to Save You Money Now!  ,Kindle,2016,2
"Everything, Everything  ",Paperback,2017,6968
"Christmas Planner & Diary: Notebook Journal with Holiday Shopping List, Gift Planner, Online Order and Greeting Card Address Book Tracker  ",Paperback,2019,1
Celestial Large-Format Internet Address & Password Logbook (removable cover band for security)  ,Hardcover-spiral,2016,4962
Conversion Optimization: The Art and Science of Converting Prospects to Customers  ,Kindle,2010,36
"The No-Spend Challenge Guide: How to Stop Spending Money Impulsively, Pay off Debt Fast, & Make Your Finances Fit Your Dreams  ",Paperback,2017,1141
AMAZON'S ASSOCIATE PROGRAM: Make Money Selling Amazon Affiliate Products Online. A Step-By-Step Guide for Amazon Associates Program.  ,Paperback,2019,123
Weekly Meal Planner: 52 Weeks of Menu Planning Pages with Weekly Grocery Shopping List - Pineapple Pattern  ,Paperback,2019,692
The Prediabetes Diet Plan: How to Reverse Prediabetes and Prevent Diabetes through Healthy Eating and Exercise  ,Paperback,2013,743
Meal Prep for Weight Loss: Weekly Plans and Recipes to Lose Weight the Healthy Way  ,Paperback,2019,2015
Clickology: What Works in Online Shopping and How Your Business can use Consumer Psychology to Succeed  ,Kindle,2013,14
Spent: Break the Buying Obsession and Discover Your True Worth  ,Paperback,2009,211
Prague Shopping Guide: From Trinkets to Treasures  ,Kindle,2018,5
"iGen: Why Today's Super-Connected Kids Are Growing Up Less Rebellious, More Tolerant, Less Happy--and Completely Unprepared for Adulthood--and What That Means for the Rest of Us  ",Paperback,2018,957
Shit I Can't Remember: An Organizer for All Your Passwords and Shit  ,Paperback,2017,9079
Best of the Best from Bell's Best Cookbook  ,Kindle,2010,290
"Cancel Amazon Kindle Unlimited Membership Now: STEP BY STEP, QUICK AND EASY GUIDE on How to Cancel Kindle Unlimited membership sub in less than a minute  ",Kindle Edition,2019,3
Harry Potter: The Complete Collection (1-7)  ,Kindle,2015,91498
Scam Proof Your Online Shopping - Safety Tips For Shopping Online (Online Shopping Credit Card Safety Book 1)  ,Kindle Edition,2012,14
Diabetes & Carb Counting For Dummies (For Dummies (Lifestyle))  ,Paperback,2017,832
LSAT Prep Plus 2020-2021: Strategies for Every Section + Real LSAT Questions + Online (Kaplan Test Prep)  ,Paperback,2019,1477
"Best Buyer Book: The How To Of Negotiating Your Next New or Used Car or Truck: Negotiate your best lease, finance or cash deal in less than 30 minutes ... confrontation by knowing how a dealership  ",Kindle,2017,8
"How To Live Cheap In An UnCheap World: Money Saving Tips And Ways To Save Money On Grocery Shopping, Car Repairs And How To Make Money Online Doing Freelance ... (Live FREE In An UNFREE World Book 1)  ",Kindle,2015,44
Bargain Math  ,Paperback,2018,47
My Last Words and Wishes: Helpful information for when I'm gone  ,Paperback,2017,254
Internet Addiction: Kicking the Habit: 30 Day Plan To Take Back Your Life  ,Kindle,2016,41
"Kids Summer Academy by ArgoPrep - Grades 6-7: 12 Weeks of Math, Reading, Science, Logic, Fitness and Yoga | Online Access Included | Prevent Summer Learning Loss  ",Paperback,2019,730
eBay For Dummies  ,Paperback,2019,316
Shit I Can't Remember Internet Address & Password Logbook: Premium Alphabetical Organizer To Protect Usernames and Passwords (Pink Pastel Floral)  ,Paperback,2019,286
"The Franklin Cover-up: Child Abuse, Satanism, and Murder in Nebraska  ",Mass Market Paperback,2011,958
Parent Alert: How to Keep Your Kids Safe Online  ,Paperback,2018,52
"Essential Ottolenghi [Special Edition, Two-Book Boxed Set]: Plenty More and Ottolenghi Simple  ",Hardcover,2019,819
"How to Eat a Low-Salt Diet: Tips and Tricks to Help You with Low-Sodium Shopping, Cooking, and Restaurants  ",Paperback,2018,108
The Easy 5-Ingredient Healthy Cookbook: Simple Recipes to Make Healthy Eating Delicious  ,Paperback,2018,1668
"Dinotopia, A Land Apart from Time: 20th Anniversary Edition (Calla Editions)  ",Hardcover,2011,1371
Green Smoothie Recipes to Kick-Start Your Health and Healing: Based On the Best-Selling Book Goodbye Lupus  ,Paperback,2014,934
"Radiant: His Light, Your Life for Teen Girls and Young Women  ",Paperback,2019,1017
The Coffee Recipe Book: 50 Coffee and Espresso Drinks to Make at Home  ,Paperback,2019,886
Amazon and the Rise of E-commerce: The story of Jeff Bezos’ revolutionary company (Business Stories)  ,Kindle,2017,1
QuickBooks 2019 All-in-One For Dummies  ,Paperback,2018,356
How To Purchase Products From 1688.com Without Needing Chinese Agents/Suppliers: A step-by-step guide to importing products from 1688.com  ,Paperback,2019,3
Needless Casualties of War  ,Paperback,2016,984
"Dana Carpender's NEW Carb and Calorie Counter-Expanded, Revised, and Updated 4th Edition: Your Complete Guide to Total Carbs, Net Carbs, Calories, and More  ",Paperback,2009,1035
"Understanding Exposure, Fourth Edition: How to Shoot Great Photographs with Any Camera  ",Paperback,2016,1941
"The Official Stupid Simple Keto Handbook: Ketogenic diet beginners guide, shopping lists, meal plans, recipes, and more!  ",Paperback,2019,156
"Renal Diet Cookbook: The Low Sodium, Low Potassium, Healthy Kidney Cookbook  ",Paperback,2015,2514
Blast Off to Reading!: 50 Orton-Gillingham Based Lessons for Struggling Readers and Those with Dyslexia  ,Paperback,2012,905
Drift (Rachel Hatch Book 1)  ,Kindle,2019,18548
A Stranger in the House: A Novel  ,Paperback,2018,8348
Beyond Amazon: Shopping for the Absolute Lowest Prices on the Internet (FIRST EDITION)  ,Kindle,2011,1
"Hacks for Alexa: An Unofficial Guide to Settings, Linking Devices, Reminders, Shopping, Video, Music, Sports, and More  ",Kindle,2019,69
The Science of Making Friends: Helping Socially Challenged Teens and Young Adults  ,Paperback,2013,244
Her Billionaires (Her Billionaires #2)  ,Kindle,2013,778
The Food of Sichuan  ,Hardcover,2019,875
The Ultimate Guide to the Rider Waite Tarot  ,Paperback,2013,3324
"Shit I Can't Remember: Organizer, Log Book & Notebook for Passwords and Shit  ",Paperback,2019,40
The Longmire Mystery Series Boxed Set Volumes 1-4: The First Four Novels (Walt Longmire Mysteries)  ,Paperback,2012,1585
"Jab, Jab, Jab, Right Hook: How to Tell Your Story in a Noisy Social World  ",Hardcover,2013,2531
"Bundle: Pathways: Listening, Speaking, and Critical Thinking 2, 2nd Student Edition + Online Workbook (1-year access)  ",Paperback,2017,297
"Password Log Book: Account And Password Book, Password Directory Personal, Internet Password Organizer, Password Notebook Organizer, Music Lover Cover  ",Paperback,2018,39
Inside the Mind of the Shopper: The Science of Retailing  ,Kindle,2016,12
"Amazon Prime: Tips and Tricks to Get the Most Out Of Your Amazon Prime Membership, How to Join Amazon Prime  ",Paperback,2019,65
Super Easy Baby Food Cookbook: Healthy Homemade Recipes for Every Age and Stage  ,Paperback,2018,1124
The Fabliaux  ,Hardcover,2013,34
"You Think It, I'll Say It: Stories  ",Paperback,2019,1002
Password & Account Number Book: Never forget the password again (Password Book)  ,Paperback,2018,897
"Shopping Addiction Therapy: Stop The Credit Card Abuse - Addiction Treatment For Shopping Addicts (Shopping Addiction, Debt Free, Credit Repair, Addiction ... Treatment, Cognitive Behavioral Th)  ",Kindle,2014,8
"Musical Inventions: DIY Instruments to Toot, Tap, Crank, Strum, Pluck, and Switch On (Make)  ",Paperback,2017,28
The Years That Matter Most: How College Makes or Breaks Us  ,Hardcover,2019,284
Happily Ever After: Companion to the Selection Series (The Selection Novella)  ,Paperback,2016,3187
Pusheen 2020 Wall Calendar  ,Calendar,2019,1955
"ATI TEAS 6 Study Guide: Spire Study System and ATI TEAS VI Test Prep Guide with ATI TEAS Version 6 Practice Test Review Questions for the Test of Essential Academic Skills, 6th edition  ",Paperback,2019,1996
I Forgot To Remember Internet Address & Password Logbook: Premium Alphabetical Organizer To Protect Usernames and Passwords (Pink Pastel Floral)  ,Paperback,2019,32
"Thrifting and Winning: 50 Ways To Make Money Buying Items At Thrift Stores And Selling Them For Huge Profits (Making Money Online, Thrifting for Profit, ... eBay, eBay Secrets, Thrift Store Reselling)  ",Kindle,2015,16
The Life-Changing Magic of Tidying Up: The Japanese Art of Decluttering and Organizing  ,Hardcover,2014,28091
"Always Delicious: Over 175 Satisfying Recipes to Conquer Cravings, Retrain Your Fat Cells, and Keep the Weight Off Permanently  ",Paperback,2019,296
"The Year of Less: How I Stopped Shopping, Gave Away My Belongings, and Discovered Life is Worth More Than Anything You Can Buy in a Store  ",Kindle,2018,2423
The Gluten-Free Bread Machine Cookbook: 175 Recipes for Splendid Breads and Delicious Dishes to Make with Them  ,Paperback,2016,896
Fancy Nancy: Nancy Clancy's Ultimate Chapter Book Quartet: Books 1 through 4  ,Paperback,2015,1496
How Amazon Smile Works: Charity Program Details  ,Kindle,2017,51
Take That Job And Mystery Shop It!: How You Can Find Success in the Mystery Shopping Business  ,Hardcover,2014,8
Addicted to the Monkey Mind: Change the Programming That Sabotages Your Life  ,Paperback,2018,1301
"Super Simple Baking for Kids: Learn to Bake with over 55 Easy Recipes for Cookies, Muffins, Cupcakes and More! (Super Simple Kids Cookbooks)  ",Paperback,2019,1434
"Practical Paleo, 2nd Edition (Updated And Expanded): A Customized Approach to Health and a Whole-Foods Lifestyle  ",Paperback,2016,4391
Let's Stay In: More than 120 Recipes to Nourish the People You Love  ,Hardcover,2018,112
The Lyme Disease 30-Day Meal Plan: Healthy Recipes and Lifestyle Tips to Ease Symptoms  ,Paperback,2019,163
The Complete Clean Eating Cookbook: 200 Fresh Recipes and 3 Easy Meal Plans for a Healthy Diet  ,Paperback,2019,995
Como Vender en Amazon: Guia Basica para Crear una Marca Propia de Productos y Lanzarlos en Amazon USA en tan Solo Dias (Emprendedor Ninja) (Spanish Edition)  ,Kindle Edition,2018,16
Retail Therapy: Why The Retail Industry Is Broken – And What Can Be Done To Fix It  ,Kindle,2019,35
Italy The Best Places to See by Rail: An alternative to the escorted tour  ,Paperback,2018,207
Lost Department Stores of Denver  ,Kindle,2018,16
"Warman's Depression Glass Handbook: Identification, Values, Pattern Guide  ",Paperback,2017,345
McGraw-Hill Education 500 Review Questions for the MCAT: Physics  ,Paperback,2015,2
"The Leader in Me: How Schools Around the World Are Inspiring Greatness, One Child at a Time  ",Paperback,2014,606
PURE OF HEART - A Fantasy Adventure  ,Kindle,2015,294
